{
  "$schema": "https://json-schema.org/draft/2020-12/schema",
  "type": "object",
  "required": ["schema_version", "deployment_id", "version", "model_ids"],
  "properties": {
    "schema_version": {"type": "integer", "enum": [1]},
    "deployment_id": {"type": "string", "minLength": 1, "pattern": "^[A-Za-z0-9._-]+$"},
    "version": {"type": "string", "minLength": 1},
    "model_ids": {
      "type": "object",
      "minProperties": 1,
      "additionalProperties": {"type": "string", "minLength": 1}
    }
  },
  "additionalProperties": false
}
